tweet_id,created_at,full_text,user_id,in_reply_to_status_id,retweet_count,favorite_count,lang,tweet_id_str
744721367547842560,2016-06-20 02:39:44+00,Please don't riot Oakland. We have no police chief.,15517162,,228,370,en,744721367547842560
744736706721628160,2016-06-20 03:40:42+00,When u r drunk and Landslide comes on https://t.co/63FB4IZZug,3099901028,,630,1731,en,744736706721628160
745288603291508736,2016-06-21 16:13:44+00,"All I'm saying is that if Trump were really a friend of the gays, one of us would have fixed his wig and makeup by now.",551259536,,7873,13379,en,745288603291508736
745824533622337536,2016-06-23 03:43:20+00,5 minutes into toy story n chill and I already have a friend in me,2881773164,,427,1034,en,745824533622337536
746032197342232576,2016-06-23 17:28:31+00,i paid for in-flight wifi so i could tweet this immediately https://t.co/nnwpcyYC8V,20419879,,63436,131056,en,746032197342232576
746431687580491776,2016-06-24 19:55:57+00,"i want to DIE

D- do better in life 
I- improve my mental health 
E- emotionally connect w other humans",2321669628,,4708,6570,en,746431687580491776
746803108949409793,2016-06-25 20:31:50+00,"THERAPIST: you've started calling objectively awful things ""insanely good"" to protect yourself from how awful the world is
ME: lol that owns",7961342,,10300,28157,en,746803108949409793
746890933904375808,2016-06-26 02:20:49+00,*whispers during sex* do u think i'm a loser?,26671726,,566,1189,en,746890933904375808
748248455865376768,2016-06-29 20:15:08+00,"Barack can u handle this?
Justin can u handle this?
Enrique can u handle this?
I don't think they can handle this! https://t.co/aNIlt0f6F7",39267537,,24113,36472,en,748248455865376768
748582543583121408,2016-06-30 18:22:41+00,Tbt to Halloween when I dressed as the babadook but my friend's house had more of a grown ups drinking wine vibe https://t.co/PoGKUFeLLw,79961137,,120451,344519,en,748582543583121408
748711242831888384,2016-07-01 02:54:05+00,"Are you a real 90s kid?
1. You ate gushers!
2. You watched Doug!
3. You heard Marilyn Manson got his ribs removed to suck his own dick.",145625854,,379,1354,en,748711242831888384
750517615651540992,2016-07-06 02:31:58+00,What in all holy hell is going on with this box of toilet paper I just got from Amazon https://t.co/ZJ0P9ntExc,66476513,,4497,11173,en,750517615651540992
750708361595846656,2016-07-06 15:09:55+00,saw this stocky horse on my walk . he started posing. at 1st jus a lil leg action then boom. Super model finish https://t.co/tj1WWndjA1,98509211,,596,2189,en,750708361595846656
751542778753081344,2016-07-08 22:25:36+00,It's been 5 years since @USATODAY published this perfection. Why isn't it at the @Newseum yet? #heatstroke https://t.co/TiMMQrBbxj,15100219,,289,509,en,751542778753081344
753482686648295424,2016-07-14 06:54:06+00,i blocked my ex on everything but she some how managed to message me through direct tv https://t.co/xpPZPSCgLB,590385095,,63782,124839,en,753482686648295424
754811607188766720,2016-07-17 22:54:45+00,I'm renaming my cats Thoughts and Prayers because they are also useless in dealing with gun violence.,15777611,,393,752,en,754811607188766720
755054091139633152,2016-07-18 14:58:18+00,Okay I just had to get 'em side by side. L: GOP Capitol Hill interns. R: DNCC interns. #2016 https://t.co/KCuPhWUujn,93476253,,3538,4816,en,755054091139633152
755266200247099392,2016-07-19 05:01:08+00,https://t.co/uXyubK9Kt3,628717625,,6963,8858,zxx,755266200247099392
755511596047298564,2016-07-19 21:16:15+00,"One day, Donald Trump is going to look a reporter straight in the eyes on national TV and say ""I never ran for President.""",15267025,,31979,54317,en,755511596047298564
756561607631568896,2016-07-22 18:48:38+00,"Last night at The Gathering, Warren G came out, did ""Regulate"", saw that the place was sufficiently regulated, then left. #seriously #GOTJ",18746498,,5,24,en,756561607631568896
756640481476382720,2016-07-23 00:02:03+00,Oh my good lord. https://t.co/t5aJfVmSt2,11855482,,2,36,en,756640481476382720
760667825082015744,2016-08-03 02:45:16+00,"One of the most often misused quotes out there: ""You either die a hero, or you live long enough to see yourself become the villain.""",294306372,,16,58,en,760667825082015744
763733803500236800,2016-08-11 13:48:22+00,"They Call It............""Fucking"".........Teens Are Hiding Pieces Of Themselves Inside Each Other TO GET HIGH",19441929,,261,773,en,763733803500236800
764702682539896832,2016-08-14 05:58:21+00,The best part of Kevin Hart's wedding pic is him standing 10 feet in the foreground to be as tall as his wife. https://t.co/EPAp3dtmms,27792033,,12512,19924,en,764702682539896832
766347309248417793,2016-08-18 18:53:31+00,"Me:Do you think Yogi Bear killed someone for that hat and tie? I mean hes a bear he cant buy it
Boss:I meant questions about the project",1566900048,,861,1538,en,766347309248417793
766649126092206081,2016-08-19 14:52:49+00,How would it feel to rearrange this actual deck chair from the Titanic? https://t.co/9u0KcOnMrZ https://t.co/ecjdpSqXJz,1440641,,11,21,en,766649126092206081
766656527302295556,2016-08-19 15:22:14+00,Hit it from the back know that shit wet af 😩💦 RT @vulgarswami Water lowkey thicc https://t.co/Ux3fy2YfIP,53960675,766424771580002304,22,37,en,766656527302295556
768179529487712256,2016-08-23 20:14:06+00,caught someone recharging herself on mother's hate crystal https://t.co/hH17Uy7TDn,299820130,,26,256,en,768179529487712256
768286842991022080,2016-08-24 03:20:32+00,Man this deer must have been fucking rich. https://t.co/biMHRZOsi7,7961342,,4,35,en,768286842991022080
944802406197616640,2017-12-24 05:30:21+00,why would you name a store with diamonds in it Jared,31069486,,287,2667,en,944802406197616640
768852936860569600,2016-08-25 16:49:59+00,"MORPHEUS: you can take the red pill or the blue pill or the jagged little pill
ME: i dont know what that one does
MORPHEUS: you oughta know",15605430,,890,1952,en,768852936860569600
771422577118089216,2016-09-01 19:00:49+00,heading off to your dick appointment after the whole squad collaborated on the texts https://t.co/8OK6b0BUqP,98509211,,1413,6683,en,771422577118089216
771463229495271428,2016-09-01 21:42:21+00,"""RIP my Mentions"" -me, gravely, as they lower the casket of my husband, Jonathan Mentions",3099901028,,3075,11523,en,771463229495271428
771814692864028672,2016-09-02 20:58:57+00,"THERAPIST: Ever had a job?
ME: I once worked at a zoo
T: Great! &amp; what did you take from that?
ME: Definitely not a penguin
T: What
M: What",3011037227,,2367,4836,en,771814692864028672
771992925727100932,2016-09-03 08:47:11+00,"pretty woman
walkin down the street
pretty woman
please send pics of feet",39291341,,116,577,en,771992925727100932
772899203609726976,2016-09-05 20:48:24+00,"Me: How can Kool-Aid Man smash through a brick wall fully intact when he's made of glass?
Interviewer: I meant questions about the job",20254815,,1768,3818,en,772899203609726976
773338613270605825,2016-09-07 01:54:27+00,"[GOD INVENTING THE WEASEL]

You know what we need?  An otter you can't fucking trust.",174406574,,11350,22215,en,773338613270605825
773768496924635136,2016-09-08 06:22:40+00,"Me, pitching to investors: This simple device takes your blood
Investor: And gives you a diagnosis?
Me: No",2999158160,,570,1975,en,773768496924635136
774855950070972417,2016-09-11 06:23:49+00,The reason cats are so pissy is they're God's perfect killing machines but they only weigh 8lbs and we keep picking them up and kissing them,14166235,,17090,33493,en,774855950070972417
776204140569513984,2016-09-14 23:41:02+00,"So today I was lookin at a girl bcuz she had a piece of lettuce in her hair &amp; she looks at me and said ""I have a boyfriend"" ok lettuce head",1048998290,,215936,470889,en,776204140569513984
777222991503433728,2016-09-17 19:09:35+00,life is peachy https://t.co/7kFneRutMW,81411085,,1,6,en,777222991503433728
779164690576347136,2016-09-23 03:45:13+00,wow cool https://t.co/t9fXpTb0yk,153663902,,11,26,en,779164690576347136
779609435731877888,2016-09-24 09:12:28+00,https://t.co/99VGrTUfnL,16719596,,461,851,zxx,779609435731877888
781156872,2008-04-02 00:06:06+00,Packing involves simple math: 3 day trip = 3 pairs of pannies plus two extra for when I crap myself on the flight there and back.,7702542,,741,1463,en,781156872
781475146083213312,2016-09-29 12:46:08+00,"""What countries did white people ruin ?"" https://t.co/2Yl9YUDDOu",1090090759,,19232,25185,en,781475146083213312
782349934691581953,2016-10-01 22:42:14+00,Spent about 15 hours stitching this feminist art meme 😂 https://t.co/evK0s3R6ke,572913317,,42292,129273,en,782349934691581953
782520849815470080,2016-10-02 10:01:23+00,"#TwitterHubris: a play in four acts. 

via @Anotherfilmnerd https://t.co/wB05TtbZle",254873869,,5593,8591,en,782520849815470080
782754055806341121,2016-10-03 01:28:04+00,cursed image 913 https://t.co/xUBlFJI6JU,759123604269248512,,1684,3360,en,782754055806341121
786344220978139136,2016-10-12 23:14:06+00,"Her: babe I want sushi
Me: bone app the teeth https://t.co/Bp1FF1oql2",745808305,,30904,58737,en,786344220978139136
787799268342001665,2016-10-16 23:35:56+00,"I call my vagina ""New Yorker cartoon"" because it's dry and a handful of people have laughed at it",35206553,,4075,26619,en,787799268342001665
788918264512466944,2016-10-20 01:42:26+00,"ppl like ""what's with Hilary's pantsuit, she looks like a interplanetary leader from the future""
FUCKING
DUH
DRESS FOR THE JOB YOU WANT",16472748,,7212,21389,en,788918264512466944
791034411953315840,2016-10-25 21:51:15+00,my kindness is NOT weakness. my patience is NOT permission to be cruel. my shoes ARE glow in the dark but i only found out AFTER i got them,98509211,,11730,31368,en,791034411953315840
791272315363483648,2016-10-26 13:36:35+00,is wiki leaks hacking twitter agian or are the people leaving numb skull comments on my page actual human beings,16298441,,1069,4011,en,791272315363483648
791601056522334208,2016-10-27 11:22:53+00,"To the tune of Eleanor Rigby:

Dog in a trenchcoat
Getting promoted at work but then sheds his disguise
Canine surprise",22001348,,20763,45398,en,791601056522334208
792589168991997955,2016-10-30 04:49:18+00,Tbt to Halloween when I went to my friend's house for a grown ups drinking wine party but there was more of a babadook vibe. https://t.co/I2ROJBHkfB,2861736400,,23020,55625,en,792589168991997955
792757734072520705,2016-10-30 15:59:07+00,when you realize the statue of mona lisa looks like keith urban 😳 https://t.co/Fh1iDxBvBf,1429239542,,16877,34989,en,792757734072520705
794659585885958144,2016-11-04 21:56:23+00,"Calling all Lamas
Meet on spooky corner
Repeat
Meet on spooky corner
Over https://t.co/gCFqvGbanW",53200348,,1451,2543,en,794659585885958144
795362873396654080,2016-11-06 20:31:00+00,Attenborough has no respect for crabs. Always gives them ridiculous music. They are jesters to him,239879394,,15332,40780,en,795362873396654080
797249045270003712,2016-11-12 01:25:59+00,A story told in four pics https://t.co/IwG1RcJ9Wt,1222659163,,38682,71985,en,797249045270003712
798393636442558470,2016-11-15 05:14:11+00,"wait did you say she was ""thicc as hell boi"" or ""thicc as Hellboy""",73281364,,2920,6258,en,798393636442558470
798690836187938816,2016-11-16 00:55:08+00,https://t.co/o8q9dwjvzO,4567901,,35057,89133,zxx,798690836187938816
799088750529748992,2016-11-17 03:16:19+00,Phillip K Dick's wikipedia section headers sound exactly like how I imagine my 2017 https://t.co/KVcPqM8B1C,182551379,,239,707,en,799088750529748992
800823370480644096,2016-11-21 22:09:04+00,"wow, a dark underside https://t.co/sO0jOgXCkf",714494928,,7831,17891,en,800823370480644096
801170075516596225,2016-11-22 21:06:45+00,"I am NOT a grammar Nazi! 
I'm alt-write.",386206970,,9067,15587,en,801170075516596225
801579893112782848,2016-11-24 00:15:13+00,"the turkey takes his mask off
it's edward snowden
obama groans, it's too late to unpardon him now",47509268,,4149,9642,en,801579893112782848
805421890168913920,2016-12-04 14:41:57+00,"This horse did not sign up for a photo opportunity with Marine Le Pen, and he wants you to know it https://t.co/34jLjeXoO7",394862363,,6742,10891,en,805421890168913920
805822252918984704,2016-12-05 17:12:51+00,"After this year, I never want to hear ""We're looking for 5-7 years job experience"" ever again. https://t.co/VPjM1ps2H4",286998245,,3217,4772,en,805822252918984704
807425581096796164,2016-12-10 03:23:54+00,I'm disappointed in Sarah Palin more than any other human being. She saw what Russia was doing from her backyard and chose to say nothing.,24272129,,20548,51551,en,807425581096796164
808095288644734976,2016-12-11 23:45:05+00,"doctor: Have you had diarrhea
me: not more than usual
doctor: What is usual
me: It means the regular amount you have every day",14248784,,57,479,en,808095288644734976
808481890738896896,2016-12-13 01:21:18+00,🚣 https://t.co/004phFkLT9,18971427,,14486,33661,qme,808481890738896896
808783680353116160,2016-12-13 21:20:30+00,"Either these descriptions are being trimmed, or this is the greatest copywriter of ALL TIME https://t.co/XZ26PFdPOO",1919231,,2591,4940,en,808783680353116160
808862436648329216,2016-12-14 02:33:27+00,.@ASOS_HeretoHelp got my jeans from y'all today. Is this a joke?? These are NOT 32/32 jeans. I placed 32/32s next to them for reference 😳😂 https://t.co/A6CVaJRPHG,19265554,,51999,120985,en,808862436648329216
808868797490696192,2016-12-14 02:58:44+00,Alan Thicke LOVED hockey! He also was a man with a huge heart. He was on the ice when his heart attacked him. RIP Alan...,18396070,,290,1141,en,808868797490696192
811205287646400512,2016-12-20 13:43:06+00,"Yes, your request is within the Sunnah.
But it should be worded differently. https://t.co/y1IuykT0d8",201800640,,2845,4695,en,811205287646400512
811265565054685186,2016-12-20 17:42:37+00,"1996: Why do they call the internet “the web”

20 years later, trapped &amp; unable to leave: Oh",19638752,,10238,17189,en,811265565054685186
811403862234071040,2016-12-21 02:52:10+00,"""God bless us, every one!"" —Tiny Timb https://t.co/aVY9YlswVL",414485594,,6541,16659,en,811403862234071040
811761575748980736,2016-12-22 02:33:36+00,a guy I gave my number to on tinder and never met irl just sent me this after months of not texting https://t.co/2L4KPf0asL,15239226,,63,234,en,811761575748980736
812434888888635392,2016-12-23 23:09:06+00,"in Britain Arby's is called Arbies and their slogan is ""we've the meats""",73281364,,237,849,en,812434888888635392
812460432355037185,2016-12-24 00:50:36+00,"SISTER: [opening xmas gift] this is just a copy of bloc party's 2005 album ""silent alarm""
ME: have you heard it recently tho. it holds up",281206788,,394,1535,en,812460432355037185
813254620466188288,2016-12-26 05:26:25+00,"*travels to 1946*
me: congrats on crushing those nazis!
him: thanks! what's 2016 like?
me: well
him: i bet it has like zero nazis
me: well",16877374,,12233,27764,en,813254620466188288
814516607787630592,2016-12-29 17:01:06+00,"BANK TELLER: to open an account I'll need a first name
ME: Robin 
BT: and a last?
ME: Dabanc
BT: so ur Robin Dabanc
Me: *slowly reveals gun*",356942233,,10374,17445,en,814516607787630592
816278466677145600,2017-01-03 13:42:06+00,"my sister is about to have a baby and my brother showed up to the hospital in a suit because ""first impressions matter"" https://t.co/KtNV4mvnDU",727054207,,116838,384920,en,816278466677145600
816880793788223488,2017-01-05 05:35:32+00,"he's a young pope
he loves his Father
loves Jesus
and the Vatican too",36158688,,123,694,en,816880793788223488
817053630784294913,2017-01-05 17:02:20+00,"despite all my rage
i am still just a pope of young age",50085432,,167,997,en,817053630784294913
817122034996101124,2017-01-05 21:34:09+00,It's 4:20 you know what that means https://t.co/UgRvawfKGM,498819548,,9142,26625,en,817122034996101124
817446287599489024,2017-01-06 19:02:37+00,"if ur ever feeling sad, just remember that criss angel has been waging a wizard war against david copperfield on twitter for over 6 years https://t.co/7DDWC132c1",190172686,,1444,4808,en,817446287599489024
817457217372848128,2017-01-06 19:46:02+00,The crack team of cyber experts at Wikileaks are evidently still trying to master the nuances of LinkedIn https://t.co/X4U2oOB6bA,452521774,,73,139,en,817457217372848128
818871248432361473,2017-01-10 17:24:54+00,"i usually go paperless but this tweet deserved to be emailed, printed out, and posted on the literal @sfsymphony percussion room wall. https://t.co/8XrzFAYVTc",400852598,,1969,6289,en,818871248432361473
818938867415969793,2017-01-10 21:53:35+00,here is megagroup Backstreet Boys turning into a Linksys router https://t.co/fJNGYLrHM0,14573958,,1396,2895,en,818938867415969793
821471790035677184,2017-01-17 21:38:31+00,"""He tweeted what?"" Obama chuckled, as he held the Chaos Emeralds up to the light",47509268,,115,377,en,821471790035677184
821606828006055936,2017-01-18 06:35:07+00,how u think your drunk nudes look vs how they look the next morning https://t.co/0ddQO32yfJ,21164689,,51,422,en,821606828006055936
821718426037194757,2017-01-18 13:58:34+00,"GIRLFRIEND: Do you want to move in together?
ME: That is a decision best left to the states.",321738572,,937,4068,en,821718426037194757
823286330146713600,2017-01-22 21:48:51+00,"I also endured this hardship. i fed my son Tevin dog food and accidentally set fire to my daughter, whatshername. https://t.co/jhuZppepa9",330729127,,6553,19180,en,823286330146713600
823848392027701249,2017-01-24 11:02:17+00,"therapist: do any sounds annoy you
me: real sounds or imaginary sounds
therapist: [curious] lets say imaginary
me: spider wearing flip flops",624661805,,5608,12488,en,823848392027701249
823942113838542848,2017-01-24 17:14:42+00,These have got to be the two dumbest people alive https://t.co/9onoJEvIzz,89337404,,27534,65215,en,823942113838542848
824002958731972609,2017-01-24 21:16:29+00,badlands national park savagely elbows the grand canyon out of the way to become the national park I most want to fuck,299820130,,1056,6176,en,824002958731972609
826124303175471105,2017-01-30 17:45:57+00,I started crying in class because I tried to draw a chameleon from memory https://t.co/5c1KOAayta,2652657612,,95911,227859,en,826124303175471105
828025127468167169,2017-02-04 23:39:09+00,one of the reasons i love memes is because these two things are basically saying the same exact thing https://t.co/DQJARmq0Dl,198780666,,5095,10621,en,828025127468167169
829012482945597442,2017-02-07 17:02:32+00,Today is gonna be the day that they're gonna throw it back to you https://t.co/qCoF30eEWK,80064003,,20871,38841,en,829012482945597442
829097929080123392,2017-02-07 22:42:04+00,i started singing 'chemtrails' in the tune to the ducktales theme a half hour ago so i just had to make this real quick: https://t.co/Gmf83VpsyA,36672876,,9796,18890,en,829097929080123392
829404603493949440,2017-02-08 19:00:41+00,🤔 https://t.co/6s674G6h6i,28549816,,18382,44031,qme,829404603493949440
829500883998228480,2017-02-09 01:23:16+00,https://t.co/7eiX66KCOi,727338733423464448,,467,1668,zxx,829500883998228480
831011010643316736,2017-02-13 05:23:59+00,https://t.co/2gafG5iYy3,4039941853,,275,834,zxx,831011010643316736
831541951686078465,2017-02-14 16:33:45+00,"Roses are red
Violets are phony
Some
BODY ONCE TOLD ME
THE WORLD WAS GONNA ROLL ME",138281195,,1751,2973,en,831541951686078465
831586851127455749,2017-02-14 19:32:10+00,ah this fantasy job where im paid millions of dollars to yell and play video games is great. whats next. i think ill make some nazi videos,49708023,,1055,4107,en,831586851127455749
831805955402776576,2017-02-15 10:02:48+00,"issuing correction on a previous post of mine, regarding the terror group ISIL. you do not, under any circumstances, ""gotta hand it to them""",16298441,,14884,62551,en,831805955402776576
833020025929924608,2017-02-18 18:27:05+00,"FRANCE: we're fancy
WORLD: ok
FRANCE: a fried ham sandwich is our national lunch
WORLD:
FRANCE: a fried ham sandwich with an egg is its wife",20770892,,10466,33049,en,833020025929924608
833417230591234049,2017-02-19 20:45:26+00,rt to ruin someone's day https://t.co/7wfpYDzels,715638104900538371,,17676,22268,en,833417230591234049
833553403552768001,2017-02-20 05:46:32+00,https://t.co/Mkpo8wdpQ6,156370763,833551454526771200,873,3141,zxx,833553403552768001
833715622060163072,2017-02-20 16:31:08+00,"Cat owner: I love cats!
Dog owner: who rescued who lol
Snake owner: I have served with pride as moderator on 7 forums in the past 13 years,",14248784,,1395,6582,en,833715622060163072
833857935168110592,2017-02-21 01:56:38+00,🌯Burritos 🌯are 🌯not 🌯clapping 🌯 hands 🌯,211318361,,331,1755,en,833857935168110592
837005713398431744,2017-03-01 18:24:47+00,I just had a $20 smoothie so yah I'd say sucking dick for money has been worth it,28807346,,600,2566,en,837005713398431744
842486671849459712,2017-03-16 21:24:09+00,"sorry folks, PBS has to go. they just don't get results, it's been 26 years and we still don't know where in the world is Carmen San Diego",238742810,,6406,19005,en,842486671849459712
849406960667508736,2017-04-04 23:42:55+00,Weird that everyone's mad at Pepsi but no one complained about this Coke campaign: https://t.co/9NzdmmGDin,2999158160,,1107,3881,en,849406960667508736
849668254360629248,2017-04-05 17:01:12+00,Everyone knows Kurt Cobain died 23 years ago today. What this tweet presupposes is: Maybe he didn’t? https://t.co/gT8kX9Vvw1,18036062,,95,303,en,849668254360629248
850103130486439938,2017-04-06 21:49:15+00,using twitter on your phone while you have it open on your laptop https://t.co/oHN8wldSOb,1078850120,,18760,37913,en,850103130486439938
850264603065950212,2017-04-07 08:30:53+00,Design convos # 39: 'Let's design a heart-shaped headphone splitter. It'll look cute. And def not like a pair of balls being electrocuted' https://t.co/vvgVGZhCAZ,18580891,,3240,5421,en,850264603065950212
850385985623949313,2017-04-07 16:33:13+00,good news everyone the search is over https://t.co/pb9sMe1S91,234837526,,36281,84551,en,850385985623949313
851803292652814336,2017-04-11 14:25:05+00,"UNITED: eat these nickels
MAN: no
CNN: BREAKING: Man Beaten For Not Eating Nickels On Flight
WHITE GUY ON TWITTER: shoulda eaten the nickels",15331408,,16886,42695,en,851803292652814336
852917524073242626,2017-04-14 16:12:38+00,"me: (texting boss) we still on for work today?
boss: yes. you dont have to text me this every morning. we're ""on"" for work every day mon-fri",1260075522,,6348,20455,en,852917524073242626
852949235981012994,2017-04-14 18:18:39+00,"Pitchfork: King PU$$Y Eater revolutionizes our perception of bodies and spaces with his hit single ""Goop on Ya Grinch"" [7.6]",217269914,,9389,28251,en,852949235981012994
853269692659761156,2017-04-15 15:32:02+00,"Lil Yachty said, ""She blow that dick like a cello..."" 

This is why we need to continue pushing music education in schools.",17924258,,12855,25213,en,853269692659761156
857268898508541955,2017-04-26 16:23:27+00,"Imagine being held at gunpoint (bear with me) by a literate animal, and the only hope of rescue is (BEAR WITH ME) tweeting a coded message",116718148,,29111,62672,en,857268898508541955
857672300560134144,2017-04-27 19:06:25+00,"Who Looks At a TUBA,&amp; Thinks….
“DAMN…IM GONNA SHRED🔥ON THAT MO FO”",124003770,,2428,5918,en,857672300560134144
859452839554420736,2017-05-02 17:01:39+00,Even a G gets left on read sometimes 😔 https://t.co/Co1F9Vknog,49333809,,50807,102052,en,859452839554420736
859526631647576064,2017-05-02 21:54:52+00,"1995: The internet will revolutionize the way we think and communicate

2017: https://t.co/n4aBjBFKeZ",16648821,,44319,120507,en,859526631647576064
859588377917652995,2017-05-03 02:00:14+00,"Holy f**k, it worked! #LiamNeeson https://t.co/CStddcrtYj",1312350290,,3384,8771,en,859588377917652995
860199590599020544,2017-05-04 18:28:58+00,just filed a new patent https://t.co/JTheWxsa3T,49708023,,12381,29692,en,860199590599020544
861808496098127873,2017-05-09 05:02:11+00,"[concert]
SINGER: hows everyone doin tonight
CROWD: woo
ME (from the back in a normal speaking voice): it's actually been a tough few months",2442237828,,135324,313037,en,861808496098127873
862750126523265026,2017-05-11 19:23:53+00,"What happened to the other 4,999 powermen",19896422,,36,168,en,862750126523265026
865568477733675008,2017-05-19 14:03:01+00,"Millennials aren't buying diamonds - why?
 https://t.co/VjNrSXhln2 https://t.co/XVI5VaBTEc",175322763,,128,248,en,865568477733675008
865701296002564096,2017-05-19 22:50:47+00,we got the bastard https://t.co/kIRYB7tYzx,369219105,,3478,12788,en,865701296002564096
865909530437099524,2017-05-20 12:38:14+00,75% sure if I go up and talk to this dude playing his wooden flute by the river he's gonna give me a side quest https://t.co/JVn1jIHAWG,1919231,,394,1536,en,865909530437099524
867058810770210817,2017-05-23 16:45:04+00,Heartbreaking: Hibachi Chef Tries To Make Meal On A Regular Table https://t.co/2QnspT7vcT,2377815434,,7861,14970,en,867058810770210817
867107810529742849,2017-05-23 19:59:46+00,To get my mates down the pub I cut and pasted one pint 5 times and told them there were 5 pints waiting first 5 down gets a free one 😂 https://t.co/odD5vnHbnw,422551331,,27077,113274,en,867107810529742849
867111752433102849,2017-05-23 20:15:26+00,I'm gonna be thinking about this for months https://t.co/eyKkBFpmFd,900774746,,46757,123435,en,867111752433102849
867348385719885824,2017-05-24 11:55:44+00,"Ofjared, Ofdonald https://t.co/03jdQ5VuMK",30808826,,1559,4792,nl,867348385719885824
867359569512681472,2017-05-24 12:40:10+00,"To be fair my friend followed a guy on Instagram, liked 2 pics and thought she had made her stance clear lmao https://t.co/VVftqwhLU8",712755195705483265,,4885,6132,en,867359569512681472
