tweet_id,created_at,full_text,user_id,in_reply_to_status_id,retweet_count,favorite_count,lang,tweet_id_str
1527842813316153345,2022-05-21 02:44:47+00,You want me to get a husband???The thing that killed everyone on Dateline???,16636488,,10520,88263,en,1527842813316153345
1529117214636396547,2022-05-24 15:08:48+00,"guy who pronounces LGBT as ""el jibbity""",1316536928393744384,,23835,298124,en,1529117214636396547
1529807426786041858,2022-05-26 12:51:27+00,ask not what your country can do for you. they literally won’t do it,55633995,,17893,130427,en,1529807426786041858
1530982739607953410,2022-05-29 18:41:44+00,When I retweet myself https://t.co/7aQ98ZOCyv,24272129,,2281,27222,en,1530982739607953410
1531750018100695041,2022-05-31 21:30:37+00,Pride month taught me it was ok to be a corporation,108875728,,2329,35674,en,1531750018100695041
1533569440503111681,2022-06-05 22:00:21+00,it’s a hard pill to swallow but i think we need to accept that our lives just won’t be same again. the risk will never be zero. we will always be on the verge of another morbius release,830468488967843840,,17314,207794,en,1533569440503111681
1533840888996286465,2022-06-06 15:58:59+00,i love how in the winter my personal goals are like “change careers” and “find meaning in life” and then in summer literally just “look hot” and “go swimming”,190550701,,5780,65421,en,1533840888996286465
1534239013871095808,2022-06-07 18:21:00+00,Too many of you were told as kids you'd make a great lawyer without realizing that adult was calling you a dick.,1188859346936926209,,18329,226536,en,1534239013871095808
1535397883842703360,2022-06-10 23:05:56+00,the ai art thing is fake. i’m the guy who has to draw all the requests like the chess player inside the mechanical turk. you’re torturing me. i spend every waking hour drawing shit like “joe biden asuka wedding” and “donkey kong nuremberg trials” please stop. i need to sleep,49708023,,27862,233559,en,1535397883842703360
1536893216615694338,2022-06-15 02:07:51+00,"girlfriend: now don't start weird conversations with my dad tonight

me: fine

[later]

me: [immediately] ah rugs, the coward's carpet",911735797971345411,,6866,100385,en,1536893216615694338
1536936843945590784,2022-06-15 05:01:13+00,oh we’re in a “bear market”?? well I think we’re in a platypus store. that’s what you sound like. that’s you.,201337460,,5519,56383,en,1536936843945590784
1537208767250460672,2022-06-15 23:01:44+00,you might want to think about intercepting some profits sometime soon… https://t.co/HiGkq6A1X0 https://t.co/N68BXLZe8u,131948686,,6078,101166,en,1537208767250460672
1539637101188091904,2022-06-22 15:51:04+00,"@alexanderchee oh no! Not totally the same, but my mom read my diary  and stole a couple of lines I wrote about losing my virginity and put it in her e-sig on her Sims erotica website. It was there for YEARS before I found it.",65910434,1539624134715625472,107,2585,en,1539637101188091904
1539821761415417856,2022-06-23 04:04:51+00,I really don’t know what to say about my hotel room view https://t.co/LrLmwi1az2,1075631114,,83600,1023019,en,1539821761415417856
1540489314123087872,2022-06-25 00:17:28+00,Lucifer was the Angel of light… could be his… we should make abortions widely available just to be sure 🤧 https://t.co/4vhA3YxDIc,21063822,,50,205,en,1540489314123087872
1542256075038138368,2022-06-29 21:17:56+00,sending friends tweets I think they might like is the same thing as those crows that leave little gifts of bottle caps and string,1240399498586832896,,7414,49801,en,1542256075038138368
1542366005933924352,2022-06-30 04:34:46+00,Literaleigh is a beautiful name for a girl ❤️,26447976,,29081,373393,en,1542366005933924352
1542545127658250240,2022-06-30 16:26:32+00,and on top of everything else gru is about to rise,15605430,,2597,29097,en,1542545127658250240
1542700263680741377,2022-07-01 02:42:59+00,This is legitimately one of the funniest things I've ever seen (via @connorwitt) https://t.co/Vqt9tLS6KE,40118523,,370,4351,en,1542700263680741377
1542959084680253442,2022-07-01 19:51:27+00,[nancy pelosi email voice] GRU is RISING. can I count on you for $15?,435607756,,3679,52362,en,1542959084680253442
1543039645012869123,2022-07-02 01:11:34+00,"jordan peterson got suspended on here for misgendering someone then he posted a fifteen minute video crying about how pride is a sin and that he’s banned from twitter and that he’d rather die than correct it. so basically to me he's like socrates,",49708023,,772,17591,en,1543039645012869123
1543400860524466181,2022-07-03 01:06:54+00,"i didn't ""watch"" the rise of gru i sat my white ass down and LISTENED",905977813534171137,,9406,155736,en,1543400860524466181
1543804298215268358,2022-07-04 03:50:01+00,July 4th shouldn’t be celebrated as a pro-American holiday. It should be celebrated as it was intended. As an anti-British holiday,949923794,,2994,41314,en,1543804298215268358
1544047752488751104,2022-07-04 19:57:25+00,"due to the increase in gas prices a man hanging from the passenger side of his best friend’s ride is no longer a scrub, he is a man making smart financial decisions and I’m intrigued",1302746258646343681,,26643,234255,en,1544047752488751104
1545176475443367938,2022-07-07 22:42:34+00,Doing teletherapy from your childhood home is kind of like “reporting to you live from the scene of the accident”,1239930342,,15550,152941,en,1545176475443367938
1545390264537083904,2022-07-08 12:52:05+00,"""You have a Master's degree"", I whisper to myself as I struggle to find the end of a roll of tape.",146018918,,12580,154637,en,1545390264537083904
1545470192205037569,2022-07-08 18:09:41+00,"Yes, Your Holiness. The Anglican and the Shintoist have been dealt with. No, Your Holiness, the public still believes me to be senile. https://t.co/WtQFdPayNW",961996935421833216,,4818,56735,en,1545470192205037569
1546003206618103810,2022-07-10 05:27:42+00,The worst part about a fender bender is getting out of your car and having to meet a new person,333664490,,6957,128373,en,1546003206618103810
1546285435156037635,2022-07-11 00:09:10+00,"wikipedia: please. please just give me one dollar i'm begging you give me anything

me: [trying to look up the hamburglar's full name] shut the fuck up",911735797971345411,,16588,169095,en,1546285435156037635
1546331025101492224,2022-07-11 03:10:20+00,What the fuck am I looking at https://t.co/EFyYs1XuFE,3221888150,,1216,22278,en,1546331025101492224
1546611438650793985,2022-07-11 21:44:36+00,Hey!  Stay in your lane! https://t.co/9wPAuWYUNy,22461427,,7052,128355,en,1546611438650793985
1546626633054015490,2022-07-11 22:44:58+00,"it's here–the deepest, sharpest infrared view of the universe to date https://t.co/3rqzmReK6f",291414445,,7844,68605,en,1546626633054015490
1548293662420848641,2022-07-16 13:09:09+00,Blame it all on my roots… I showed up in croots https://t.co/PGL288sv1J,1096958744,,9097,86711,en,1548293662420848641
1551622048702668803,2022-07-25 17:34:58+00,no way. no fucking way https://t.co/Xz9As564GL,830387870,,7000,50104,en,1551622048702668803
1552723820821225472,2022-07-28 18:33:01+00,i am not having a baja blast i am actually kind of having a baja hard time,55633995,,25038,133641,en,1552723820821225472
1553616443668848642,2022-07-31 05:39:59+00,Some of todays husbands would rather listen to Kid A than take care of A Kid,10448062,,373,6478,en,1553616443668848642
1555205338214850563,2022-08-04 14:53:41+00,"got fired from my job as the guy that draws the chalk outline at crime scenes for, quote, “adding too much detail to the dick area”",732678376306188289,,3162,70233,en,1555205338214850563
1555226972195721217,2022-08-04 16:19:39+00,My favorite dessert is peach cobbler because it sounds like a job a victorian orphan would have if he was gay,3197949396,,4529,78999,en,1555226972195721217
15576151669870592,2010-12-17 01:16:58+00,surfs up!  *lies face down in a kiddy pool until death*,16298441,,590,1542,en,15576151669870592
1559315846433910786,2022-08-15 23:07:23+00,"“If you have a truck with balls hanging from it, and your truck wasn’t born with balls, and you put the balls on an elective process, you have a trans truck. Congratulations”",51056508,,15395,131818,en,1559315846433910786
1560642717582905344,2022-08-19 14:59:53+00,alvin the chipmunk wears the A on his shirt because he’s an adulterer,1385557823648505856,,4742,46945,en,1560642717582905344
1562535568981954560,2022-08-24 20:21:24+00,Be on the lookout for Elon Musk's missing child https://t.co/uazh0sJjOZ,1079916807257939968,,7325,142113,en,1562535568981954560
1562674319884292096,2022-08-25 05:32:45+00,"NEW JAMES BOND MOVIE: James if you can't overcome your generational trauma you'll never discover what it means to truly sacrifice

OLD JAMES BOND MOVIE: My name is Rebecca Ass",34088527,,10692,119850,en,1562674319884292096
1564987611445338112,2022-08-31 14:44:57+00,"anytime you feel the urge to look at ur phone while driving, pick up a book instead.",2859761771,,3421,35776,en,1564987611445338112
1565005591663230977,2022-08-31 15:56:24+00,"tiktok zoomers love the ""corn kid"" song which is the most doggo bacon early 2010s internet humor imaginable. sorry children you've become your worst fear, your moment in the sun is almost over.",17983820,,6822,124610,en,1565005591663230977
1565512354493857802,2022-09-02 01:30:05+00,democracy,1349149096909668363,,36046,362218,en,1565512354493857802
1565781474288214016,2022-09-02 19:19:28+00,"if you were the guy who saluted the nicole kidman amc ad at the May 28 screening of top gun at the universal citywalk amc in los angeles, please please please dm me i am begging you https://t.co/UrkbrmzRKC",304932002,,8435,177558,en,1565781474288214016
1567904815568814080,2022-09-08 15:56:52+00,Obama killing all of his houseplants is the most I’ve ever related to a president https://t.co/SroMRlynVd,229568548,,4535,65236,en,1567904815568814080
1569020491108597763,2022-09-11 17:50:10+00,"how i see his red flags : 

         🚩   🚩        🚩   🚩
      🚩            🚩              🚩
    🚩                                 🚩
      🚩                            🚩
           🚩                    🚩      
                🚩          🚩
                        🚩",1464981643429662728,,45497,269881,en,1569020491108597763
1569126168787566592,2022-09-12 00:50:06+00,reservations are so embarrassing like hi i’m here for my spaghetti appointment,830468488967843840,,42083,449023,en,1569126168787566592
1569447391664775169,2022-09-12 22:06:31+00,harvard kennedy students be like damn i got a war crime due at 9,2732304115,,405,8241,en,1569447391664775169
1569727675333492740,2022-09-13 16:40:16+00,"Someone who is not Christian described their general experience with white evangelicals as ""people who don't have any questions."" I immediately knew what they meant, and I'm going to thinking about that statement a long time.",891806948,,6016,54900,en,1569727675333492740
1569768600172646400,2022-09-13 19:22:53+00,actually now because of climate change there are NOT more fish in the sea,8752222,,0,19,en,1569768600172646400
1570042112347099137,2022-09-14 13:29:44+00,trans exclusionary and pro monarchy call that serf and terf,17784840,,15223,125396,en,1570042112347099137
1570924682106503168,2022-09-16 23:56:45+00,hey does anyone know whose chris steakhouse this is,17400159,,224,3922,en,1570924682106503168
1571214337762795520,2022-09-17 19:07:44+00,Bad news folks! i waited in line for 16 hours to see the queen.  But by the time i got there she was fuckin DEAD!!!!!!,16298441,,13545,165890,en,1571214337762795520
1571229671685238784,2022-09-17 20:08:40+00,"Yeah misspelled haha funny but if I ever start tweeting inspirational quotes of myself, I insist that one of my friends do me in with a shovel. https://t.co/uCP307eKNt",141099983,,207,3368,en,1571229671685238784
1576007008264007681,2022-10-01 00:32:06+00,"mary shelley: we’re going on a trip?

percy shelley: not you. you always invent frankenstein, oscar wilde gets really scared

mary shelley: please i promise i wont invent frankenstein again

[after 1 beer]

mary shelley: you idiots wanna hear a ghost story about a little freak",218166083,,577,4383,en,1576007008264007681
1576914552205496321,2022-10-03 12:38:21+00,My 2 coping mechanisms https://t.co/VyEqlK7c4F,384687345,,8722,70580,en,1576914552205496321
1577109603170471936,2022-10-04 01:33:25+00,"INTERVIEWER: can you explain this gap in your resume

ODYSSEUS: ok it’s actually a really long story",15605430,,9894,117070,en,1577109603170471936
1577711613070790738,2022-10-05 17:25:35+00,"love how the ""kayak"" wikipedia article has a section that's just roasting this child https://t.co/OcXFkRJK1F",1289214585170464773,,6621,109492,en,1577711613070790738
1577713723162054657,2022-10-05 17:33:58+00,does anyone have a good rec for a trauma therapist in NYC area? i found out someone i work with cheated on his wife,1703151301,,101,5209,en,1577713723162054657
1577834081034784768,2022-10-06 01:32:14+00,Lead singers when the drummer is getting more attention after the show https://t.co/jlH4lrD9aN,17998052,,252,3108,en,1577834081034784768
1577870037683240969,2022-10-06 03:55:07+00,My dad wants me to marry an Italian woman but he won’t say it explicitly. I’ll be like “dad I met a girl” and he’ll be like “Is she…loud?”,1323361993923780608,,7907,246232,en,1577870037683240969
1579485068799930368,2022-10-10 14:52:40+00,"percent of persons who urge others, on Twitter, to ""do better"" who are actually ""doing better"" themselves: 0%.
percent of these persons who are actually ""doing worse"": 78%--82%.",845743333,,198,1852,en,1579485068799930368
1580256851475959808,2022-10-12 17:59:27+00,Infinite Jest https://t.co/Ln9GVwmvzN,3197949396,,502,8213,en,1580256851475959808
1580582126797619203,2022-10-13 15:31:59+00,"the Thin Instagram Line represents our hard working social media managers who put their lives on the line every day serving up relatable brand content to target audiences, ignoring upset boomers, and saying ""it's been literal years since i was an intern"" https://t.co/l7DhxsHdwK",20158880,,617,9942,en,1580582126797619203
1580647787464560640,2022-10-13 19:52:54+00,"my editor, gently: what did you mean by this ?
me, sobbing: I don’t know😭",1182072016943423489,,2042,24397,en,1580647787464560640
1582895268717940736,2022-10-20 00:43:35+00,@jestom I find it funny that there was 2 emu farmer influencers and I wasn’t aware of the second racist one until now and am relieved it wasn’t “my” wholesome emu farmer influencer,122775877,1582860248305455104,119,7063,en,1582895268717940736
1583277460027678722,2022-10-21 02:02:17+00,Beetlejuice is a horror movie about what If you knew a guy who wouldn’t stop doing bits.,321787970,,10341,92652,en,1583277460027678722
1583387554354958336,2022-10-21 09:19:45+00,"""slut era"" the UK whispers as it appoints yet another PM",23354211,,7645,83370,en,1583387554354958336
1585804925103091712,2022-10-28 01:25:31+00,finally! a website that’s owned by someone who is bad,218166083,,774,7706,en,1585804925103091712
1586370485146689536,2022-10-29 14:52:51+00,"Twitter laid me off today. If you know of any open positions for engineering managers or software engineers, let me know. I was the guy who made all the stock ticker symbols like $TWTR and $TSLA into links but then forgot to make the links do anything.",14829286,,52,1501,en,1586370485146689536
1586486009000140801,2022-10-29 22:31:54+00,The last message in Twitter’s main company Slack channel: who’s our new CEO? https://t.co/gdoggtsey6,808464904575299584,,40,631,en,1586486009000140801
1586776283710717953,2022-10-30 17:45:21+00,"i did it, i was sickos for halloween. https://t.co/B7pOm5n6f8",129087178,,10485,91441,en,1586776283710717953
1587967238497337345,2022-11-03 00:37:47+00,got my $8 ready,319769408,,943,16751,en,1587967238497337345
1587975337367015428,2022-11-03 01:09:58+00,I’m gonna miss this place https://t.co/L3Y0tGBKQR,2585973360,,6217,56277,en,1587975337367015428
1588237959236653057,2022-11-03 18:33:32+00,Elon Musk may be a libertarian but he’s begging for 8 dollars with the intensity of a lifelong democratic senator,420564948,,4305,55268,en,1588237959236653057
1588739470601654272,2022-11-05 03:46:21+00,"Verification worthless as of next week, so some are choosing to go out like heroes https://t.co/s91VQIYPmR",2804332645,,7802,63760,en,1588739470601654272
1588895660262428672,2022-11-05 14:07:00+00,Imagine posting “night water hits different” on Mastodon and getting two updoots and one retoot. Get real. You’re not going anywhere.,17974586,,915,10471,en,1588895660262428672
1591306825655517184,2022-11-12 05:48:06+00,why does every public radio story start with five seconds of a reporter stepping on leaves or struggling to get on the zoom call,981920849337892865,,64,3243,en,1591306825655517184
1592580455899201541,2022-11-15 18:09:04+00,My value add: saying “thanks guys” at the end of a call after not speaking the entire meeting,1400253961664446467,,6359,77248,en,1592580455899201541
1593648716992299010,2022-11-18 16:53:57+00,"""oh i'd probably be in the cool house,"" thanks, great, get me a hedge fund full of slytherins",14230772,1593648516131323907,27,634,en,1593648716992299010
1597171130108108807,2022-11-28 10:10:46+00,DID YOU KNOW: during WWII one RAF commander ordered adorable freckles painted on all the aircraft so german gunners would feel bad about shooting them. The strategy was a massive success and the freckled plane remains a symbol of survivorship today https://t.co/OYeTf85cNy,1352066333752647683,,267,1968,en,1597171130108108807
1597230863745716225,2022-11-28 14:08:07+00,no it's not https://t.co/QNRatxBnXG,975085467535224837,,9259,88006,en,1597230863745716225
1597232032588783616,2022-11-28 14:12:46+00,this image is like if you typed “divorced” into an AI art generator https://t.co/Tz6BYb5wsD,74087670,,6342,89324,en,1597232032588783616
1597410363242295296,2022-11-29 02:01:23+00,"it's always so immediately obvious when you meet someone who is a precum baby (not from a sperm cell that was in the main/primary load). probably about 7-8% of the gen population.

absent gazes, poor circulation, and always awful conversationalists. i do wish them the best though",731176053201358848,,472,6477,en,1597410363242295296
1598513757805858820,2022-12-02 03:05:53+00,"I’m sorry, I simply cannot be cynical about a technology that can accomplish this. https://t.co/yjlY72eZ0m",9395312,,11377,75975,en,1598513757805858820
1598865363017805825,2022-12-03 02:23:02+00,"It's true: in 2014, I taught Matt Taibbi keyboard shortcuts for copy and paste. If I had not done that, maybe all this could have been averted. I am deeply sorry.",52920970,,492,8076,en,1598865363017805825
1598871443105673216,2022-12-03 02:47:12+00,"A memory: Racket staff gather at a conference table to discuss how our new political satire site will make fun of Buzzfeed. Can't agree why Buzzfeed is bad. Realize Taibbi has never seen a viral video. We play Honey Badger. ""Wow,"" he says, ""people just put this on the internet?""",52920970,,67,694,en,1598871443105673216
1599428757428658176,2022-12-04 15:41:46+00,"me: you don’t like any of my gifts

her: no! the five golden rings were nice. it’s just-

me: too many birds?

her: really bird heavy this year",218166083,,7435,90328,en,1599428757428658176
1602428890294648832,2022-12-12 22:23:13+00,Chappelle introduced him as the richest man in the world and the crowd booed him so hard they altered reality https://t.co/Vo20vTed1i,30799939,,12628,96916,en,1602428890294648832
1607054472945205250,2022-12-25 16:43:38+00,"Donner Lake, CA is uhhhhhh not named after Santa's reindeer https://t.co/n9l9YAqVoT",2537753422,,5510,52755,en,1607054472945205250
1607134763315339266,2022-12-25 22:02:41+00,"Merry Christmas, everyone https://t.co/yUGNPkeNhl",308901507,,332,2690,en,1607134763315339266
1609751283119935490,2023-01-02 03:19:48+00,"@jordanbpeterson @lexfridman Peterson, you idiot, stay out of this.",381289719,1609625079222083586,1251,13400,en,1609751283119935490
1613566112888659974,2023-01-12 15:58:34+00,me exploring the UK https://t.co/Wr1K8joxMo,924692113736044545,,10297,74900,en,1613566112888659974
1614036417457577985,2023-01-13 23:07:23+00,ur mom got out lol https://t.co/f9lR2ZwkOf,319769408,,542,7619,en,1614036417457577985
1615030448274706433,2023-01-16 16:57:19+00,honey we’re having guests please bring out our finest teapot https://t.co/TLCpQc4LqU,266417203,,24427,111888,en,1615030448274706433
1623163539803316224,2023-02-08 03:35:19+00,"BIDEN: And here's something my friends in the Republican Party won't admit. (whispering) Fleishman is in trouble. No, I'm serious",21518612,,8,88,en,1623163539803316224
1625522838458494977,2023-02-14 15:50:20+00,don’t get me wrong i’m an alcoholic but why are u cracking open a soda at 8am,766066681219284992,,3311,33700,en,1625522838458494977
1626967430370299908,2023-02-18 15:30:37+00,a group of Japanese men approached me today in Kyoto to nervously ask if I was ed Sheeran which was obviously a big blow to whatever progress I’ve made in therapy https://t.co/ysbwQD7KIh,19518808,,1655,45116,en,1626967430370299908
1627756837973143553,2023-02-20 19:47:27+00,I knew this show actually sucked ass https://t.co/B0mnfwKe1C,1144577210440794112,,467,16647,en,1627756837973143553
1627862056698347520,2023-02-21 02:45:33+00,“What would the Founding Fathers think” buddy I don’t care what my regular father thinks,589431637,,1672,12476,en,1627862056698347520
1628815776168673281,2023-02-23 17:55:17+00,"To avoid crowds, visit areas that are less crowded.",36771809,,29981,263409,en,1628815776168673281
1630377937923985408,2023-02-28 01:22:46+00,"spotify needs an irony mode. please do not incorporate LMFAO - Party Rock Anthem into my algorithm, i am holding the phone up to my pregnant wife's stomach and telling her i'm turning our kid stupid.",17983820,,1716,35353,en,1630377937923985408
1630397947761528834,2023-02-28 02:42:16+00,never really understood why a bad bitch like miss piggy threw herself at that goofy green frog but there is something about a skinny musician that makes women lose their better judgement,1302746258646343681,,5285,56116,en,1630397947761528834
1633638148977704962,2023-03-09 01:17:40+00,it’s not much but it’s honest work https://t.co/MdITR0DSgM,2353943651,,5755,93884,en,1633638148977704962
1638163185046892545,2023-03-21 12:58:33+00,Implausibility of skeletons is that they are only whole &amp; upright in medical school displays. Otherwise just loosened bones . https://t.co/NW7Uosik66,845743333,,75,713,en,1638163185046892545
1639409818334294016,2023-03-24 23:32:14+00,Found out Microsoft Teams has its own in-app stickers that you can edit and customize to your workplace needs but also more importantly that this is a default completely unedited one https://t.co/wzZ4ic8Sac,297243723,,13198,98712,en,1639409818334294016
1646517950747381762,2023-04-13 14:17:24+00,"Gm. Due to an unfortunate IRL issue, I have had to sell off a lot of BAYC apes to pay off BendDAO loans while the liquidity was available. I won't get involved in NFT trading/twitter for a while, and will just focus on my private life for the time being with my remaining apes.",1323747353308835840,,365,3254,en,1646517950747381762
1649049178767777798,2023-04-20 13:55:36+00,Musk’s unmanned rocket may have exploded but it’s an important first step towards his ultimate goal of exploding a manned rocket,2999158160,,1313,7367,en,1649049178767777798
1653553520627335171,2023-05-03 00:14:15+00,https://t.co/YZuvSzw0jy,1237607342608244736,,2077,42242,zxx,1653553520627335171
1655097905399693312,2023-05-07 06:31:05+00,"FRANZ FERDINAND: do they remember me 
ME: *encouragingly* sort of. There’s a band named after you.
FRANZ FERDINAND: are they good 
ME: *encouragingly* sort of",2156886150,,2240,43169,en,1655097905399693312
1655567526347063298,2023-05-08 13:37:11+00,yooo how was the date last night? cant help but notice that your leitmotif has incorporated a playful glockenspiel this morning 👀,830387870,,5376,37446,en,1655567526347063298
165631372327784448,2012-02-04 03:02:51+00,"Hello sir, I-*briefcase full of jellybeans falls open*",38103536,,8805,26142,en,165631372327784448
1656384398906777603,2023-05-10 19:43:09+00,(plastic vampire teeth falling out of my mouth) divorth??,1600250529128538113,,4586,19691,en,1656384398906777603
1661983066355580929,2023-05-26 06:30:15+00,"Where did you come from, where did you go?

Where did you come from https://t.co/XSoiK7KzPY",138083887,,6239,37695,en,1661983066355580929
1666125851640074240,2023-06-06 16:52:12+00,Guess who taught himself how to open the rice cooker and woke me up by screaming in between mouthfuls of hot rice https://t.co/W5gALUpUcl,2902482482,,11299,122655,en,1666125851640074240
1672344468463271937,2023-06-23 20:42:46+00,"I do not consider Batman a superhero. He is just a man in a suit. Aquaman...different situation.

Still, I do not understand the desire to explore the deep sea for fun. We are not supposed to be down there. 
https://t.co/7ZRMm3YUoP",16302242,,276,2472,en,1672344468463271937
1674071335234949120,2023-06-28 15:04:43+00,"RIP Emily Dickinson, you would have really loved Mountain Dew Summer Freeze 💙 https://t.co/RbmP5jJer4",456282494,,3871,28601,en,1674071335234949120
1678524780230656000,2023-07-10 22:01:07+00,"Justice is better than revenge. You may not be Superman, but you can help the #FBI protect the country. If you have information about a federal crime, speak now. Call 1-800-225-5324 or visit https://t.co/t8G7LO4hxu to submit a tip. https://t.co/kn9QhlNhGx",343452680,,4673,23643,en,1678524780230656000
